{
  "schema_version": "ldsdt.credential/v1",
  "credential_type": "model_deployment",
  "credential_id": "cred-team07-01",
  "deployment_id": "dep-team07-01",
  "issuer": "https://evaluation.example.edu",
  "subject": {
    "team_id": "team-07"
  },
  "source": {
    "repository": "https://git.example.edu/team-07/stage-1.git",
    "commit": "aaaaaaaaaaaaaaaaaaaaaaaaaaaaaaaaaaaaaaaa",
    "manifest_sha256": "sha256:bbbbbbbbbbbbbbbbbbbbbbbbbbbbbbbbbbbbbbbbbbbbbbbbbbbbbbbbbbbbbbbb"
  },
  "model": {
    "registry_id": "course-model-7b"
  },
  "platform": {
    "platform_class": "domestic-accelerator",
    "allocation_id": "server-group-03",
    "attestation_id": "att-72831",
    "local_inference_observed": true,
    "prohibited_external_api_observed": false
  },
  "evaluation": {
    "run_id": "run-2026-00123",
    "protocol": "ldsdt.model-service/v1",
    "result": "passed"
  },
  "issued_at": "2026-09-08T10:08:00Z",
  "revocation_endpoint": "https://evaluation.example.edu/credentials/cred-team07-01/status",
  "proof": {
    "algorithm": "Ed25519",
    "canonicalization": "RFC8785",
    "verification_method": "https://evaluation.example.edu/keys/2026-stage-1",
    "created": "2026-09-08T10:08:00Z",
    "value": "AAAAAAAAAAAAAAAAAAAAAAAAAAAAAAAAAAAAAAAAAAAAAAAAAAAAAAAAAAAAAAAAAAAAAAAAAAAAAAAAAAAAAA"
  }
}
